{
  "$schema": "https://json-schema.org/draft/2020-12/schema",
  "$id": "https://wgt-v11.invalid/schema/r5a-e3-input-contract.schema.json",
  "title": "WGT V11 R5a result-blind E3 input contract",
  "type": "object",
  "additionalProperties": false,
  "required": [
    "contract_id",
    "schema_version",
    "protocol_stage",
    "status",
    "frozen_date",
    "author_authorization_text",
    "material_passport",
    "result_awareness_boundary",
    "upstream_bindings",
    "subject_generator",
    "target_rule",
    "scenario_contract",
    "paired_disturbance_contract",
    "validation_contract",
    "permissions",
    "next_gate"
  ],
  "properties": {
    "contract_id": {"const": "WGT-V11-R5A-E3-INPUT-CONTRACT-01"},
    "schema_version": {"const": "1.0.0"},
    "protocol_stage": {"const": "R5a"},
    "status": {
      "const": "RESULT_BLIND_E3_INPUTS_AND_SCENARIO_SEMANTICS_FROZEN__NO_EFFECT_EXECUTION_AUTHORITY"
    },
    "frozen_date": {"const": "2026-07-25"},
    "author_authorization_text": {
      "const": "R5A_E3_INPUTS_FROZEN"
    },
    "material_passport": {
      "type": "object",
      "additionalProperties": false,
      "required": [
        "origin_skill",
        "origin_mode",
        "verification_status",
        "version_label"
      ],
      "properties": {
        "origin_skill": {"const": "academic-research-suite/experiment-agent"},
        "origin_mode": {"const": "plan"},
        "verification_status": {"const": "RESULT_BLIND_INPUT_CONTRACT_VALIDATED"},
        "version_label": {"const": "v11_r5a_e3_input_freeze_v1"}
      }
    },
    "result_awareness_boundary": {
      "type": "object",
      "minProperties": 9,
      "additionalProperties": {"const": false}
    },
    "upstream_bindings": {
      "type": "object",
      "additionalProperties": false,
      "required": [
        "implementation_git_root",
        "branch",
        "r6_base_commit",
        "r6_base_tree",
        "r5_contract",
        "r6_contract",
        "scientific_models",
        "decision_contract",
        "r3_model_qualification_status",
        "weight_case_name"
      ],
      "properties": {
        "implementation_git_root": {
          "const": "."
        },
        "branch": {"const": "dev"},
        "r6_base_commit": {
          "const": "a878178fd11dd1dcc7d9f32d6f1332412ea3b88a"
        },
        "r6_base_tree": {
          "const": "cf6e300f94577618fdd26d3a4cf90d7f90ed78b7"
        },
        "r5_contract": {"$ref": "#/$defs/pathHash"},
        "r6_contract": {"$ref": "#/$defs/pathHash"},
        "scientific_models": {"$ref": "#/$defs/pathHash"},
        "decision_contract": {"$ref": "#/$defs/pathHash"},
        "r3_model_qualification_status": {
          "const": "MODEL_QUALIFICATION_FAILED_POINT_MODEL_NOT_QUALIFIED_ONE_TIME_CONSUMED"
        },
        "weight_case_name": {"const": "illustrative_mechanistic_simulation"}
      }
    },
    "subject_generator": {
      "type": "object",
      "additionalProperties": false,
      "required": [
        "generator_id",
        "version",
        "seed_source",
        "domain_ascii_with_terminal_nul",
        "digest",
        "field_derivation",
        "field_grids",
        "weight_identity",
        "rounding",
        "public_subject_count",
        "public_subject_parameters",
        "parameter_table_sha256",
        "empirical_distribution_claim_allowed",
        "seed_filtering_allowed",
        "replacement_allowed"
      ],
      "properties": {
        "generator_id": {"const": "WGT-V11-R5A-E3-SUBJECT-GENERATOR-01"},
        "version": {"const": "1.0.0"},
        "seed_source": {
          "const": "R5 seed_contract.e3_public_subjects in frozen order"
        },
        "domain_ascii_with_terminal_nul": {
          "const": "WGT-V11-R5A-E3-SUBJECT-PARAMETER-v1\\0"
        },
        "digest": {"const": "SHA-256"},
        "field_derivation": {
          "const": "first8_big_endian(SHA256(domain || seed_u64_be8 || NUL || ASCII(field_label))) modulo the declared integer-grid size"
        },
        "field_grids": {
          "type": "object",
          "additionalProperties": false,
          "required": [
            "age_year",
            "height_cm",
            "bmi_kg_m2",
            "background_pal"
          ],
          "properties": {
            "age_year": {
              "const": {
                "field_label": "age_year",
                "integer_min": 30,
                "integer_max": 78,
                "grid_size": 49
              }
            },
            "height_cm": {
              "const": {
                "field_label": "height_cm_tenths",
                "integer_tenths_min": 1500,
                "integer_tenths_max": 1800,
                "grid_size": 301
              }
            },
            "bmi_kg_m2": {
              "const": {
                "field_label": "bmi_kg_m2_tenths",
                "integer_tenths_min": 250,
                "integer_tenths_max": 500,
                "grid_size": 251
              }
            },
            "background_pal": {
              "const": {
                "field_label": "background_pal_thousandths",
                "integer_thousandths_min": 1400,
                "integer_thousandths_max": 2500,
                "grid_size": 1101
              }
            }
          }
        },
        "weight_identity": {
          "const": "weight_kg = bmi_kg_m2 * (height_cm / 100)^2"
        },
        "rounding": {
          "const": "decimal ROUND_HALF_EVEN to 0.000001 kg after BMI-height identity"
        },
        "public_subject_count": {"const": 32},
        "public_subject_parameters": {
          "type": "array",
          "minItems": 32,
          "maxItems": 32,
          "items": {"$ref": "#/$defs/subject"}
        },
        "parameter_table_sha256": {"$ref": "#/$defs/sha256"},
        "empirical_distribution_claim_allowed": {"const": false},
        "seed_filtering_allowed": {"const": false},
        "replacement_allowed": {"const": false}
      }
    },
    "target_rule": {
      "type": "object",
      "additionalProperties": false,
      "required": [
        "rule_id",
        "horizon_weeks",
        "calculation_order",
        "fraction_of_scenario_initial_mass",
        "quantization_kg",
        "rounding",
        "recalculation_allowed",
        "ood_initial_mass_kg",
        "ood_target_mass_kg",
        "target_table_rows",
        "target_table_sha256",
        "design_rationale_source",
        "clinical_recommendation_claim_allowed",
        "individual_reachability_claim_allowed"
      ],
      "properties": {
        "rule_id": {"const": "WGT-V11-R5A-E3-TARGET-05PCT-26W-01"},
        "horizon_weeks": {"const": 26},
        "calculation_order": {
          "const": "apply scenario week-0 initial-state override, compute 0.95 times that total mass once, then freeze before any observation, method output, or execution"
        },
        "fraction_of_scenario_initial_mass": {"const": "0.95"},
        "quantization_kg": {"const": "0.000001"},
        "rounding": {"const": "ROUND_HALF_EVEN"},
        "recalculation_allowed": {"const": false},
        "ood_initial_mass_kg": {"const": "85.000000"},
        "ood_target_mass_kg": {"const": "80.750000"},
        "target_table_rows": {"const": 288},
        "target_table_sha256": {"$ref": "#/$defs/sha256"},
        "design_rationale_source": {
          "type": "object",
          "additionalProperties": false,
          "required": ["authority", "url", "accessed", "use_boundary"],
          "properties": {
            "authority": {
              "const": "US National Institute of Diabetes and Digestive and Kidney Diseases"
            },
            "url": {
              "const": "https://www.niddk.nih.gov/health-information/weight-management/adult-overweight-obesity/treatment"
            },
            "accessed": {"const": "2026-07-25"},
            "use_boundary": {
              "const": "5 percent over about 6 months is used only to choose a uniform illustrative 26-week simulation target; it is not model qualification or individual clinical advice"
            }
          }
        },
        "clinical_recommendation_claim_allowed": {"const": false},
        "individual_reachability_claim_allowed": {"const": false}
      }
    },
    "scenario_contract": {
      "type": "object",
      "additionalProperties": false,
      "required": [
        "scenario_count",
        "mutually_exclusive",
        "stacking_allowed",
        "decision_weeks",
        "state_weeks",
        "action_bounds",
        "combination_order",
        "endpoint_state_source",
        "rules",
        "rule_table_sha256"
      ],
      "properties": {
        "scenario_count": {"const": 9},
        "mutually_exclusive": {"const": true},
        "stacking_allowed": {"const": false},
        "decision_weeks": {"const": [0, 1, 2, 3, 4, 5, 6, 7, 8, 9, 10, 11, 12, 13, 14, 15, 16, 17, 18, 19, 20, 21, 22, 23, 24, 25]},
        "state_weeks": {"const": [0, 1, 2, 3, 4, 5, 6, 7, 8, 9, 10, 11, 12, 13, 14, 15, 16, 17, 18, 19, 20, 21, 22, 23, 24, 25, 26]},
        "action_bounds": {
          "const": {
            "intake_adjustment_kcal_day": ["-1000", "1000"],
            "activity_expenditure_adjustment_kcal_day": ["0", "1000"]
          }
        },
        "combination_order": {
          "const": [
            "SUBJECT_GENERATION",
            "SCENARIO_INITIAL_STATE",
            "TARGET_FREEZE",
            "PAST_ONLY_OBSERVATION_RELEASE",
            "NOMINAL_PLANNING_MODEL",
            "FEASIBILITY_AND_COMMIT_OR_FALLBACK",
            "EXECUTION_LAYER_TRANSFORM",
            "EVALUATION_MODEL_TRANSITION",
            "NEXT_PAST_ONLY_OBSERVATION"
          ]
        },
        "endpoint_state_source": {
          "const": "post-execution evaluation-model state at weeks 0..26, never inner candidate forecasts"
        },
        "rules": {
          "type": "array",
          "minItems": 9,
          "maxItems": 9,
          "items": {"$ref": "#/$defs/scenarioRule"}
        },
        "rule_table_sha256": {"$ref": "#/$defs/sha256"}
      }
    },
    "paired_disturbance_contract": {
      "type": "object",
      "additionalProperties": false,
      "required": [
        "domain_ascii_with_terminal_nul",
        "digest",
        "master_seed_source",
        "paired_master_seeds_u64",
        "message_bytes",
        "method_id_in_key",
        "stream_label",
        "normal_transform",
        "noise_sd_kg",
        "noise_quantization_kg",
        "noise_table_rows",
        "noise_table_sha256",
        "known_answers"
      ],
      "properties": {
        "domain_ascii_with_terminal_nul": {
          "const": "WGT-V11-R5A-E3-PAIRED-DISTURBANCE-v1\\0"
        },
        "digest": {"const": "SHA-256"},
        "master_seed_source": {
          "const": "first three R5 paired_master_seeds_u64 in frozen order"
        },
        "paired_master_seeds_u64": {
          "const": [
            "1814705672717120344",
            "11510044127855585889",
            "2013063862857590834"
          ]
        },
        "message_bytes": {
          "const": "domain || paired_master_seed_u64_be8 || subject_seed_u64_be8 || replicate_index_be4 || decision_week_be4 || ASCII(scenario_id) || NUL || ASCII(stream_label)"
        },
        "method_id_in_key": {"const": false},
        "stream_label": {"const": "observation_mass_gaussian"},
        "normal_transform": {
          "const": "u1=(digest[0:8]_be+0.5)/2^64; u2=(digest[8:16]_be+0.5)/2^64; z=sqrt(-2 ln u1) cos(2 pi u2); noise=0.5 z"
        },
        "noise_sd_kg": {"const": "0.5"},
        "noise_quantization_kg": {"const": "0.000000000001"},
        "noise_table_rows": {"const": 2496},
        "noise_table_sha256": {"$ref": "#/$defs/sha256"},
        "known_answers": {
          "type": "array",
          "minItems": 5,
          "maxItems": 5,
          "items": {"$ref": "#/$defs/noiseKnownAnswer"}
        }
      }
    },
    "validation_contract": {
      "type": "object",
      "additionalProperties": false,
      "required": [
        "generator_source",
        "generator_package_init",
        "schema_path",
        "validator_path",
        "test_path",
        "known_subject_rows",
        "known_target_rows",
        "expected_invariants",
        "effect_execution_required"
      ],
      "properties": {
        "generator_source": {
          "const": {
            "path": "src/e3_inputs/contract.py",
            "sha256": "39886aaac75e3f10724329afdde889b9efaf4af36e7b93bc1286ba95d238758e"
          }
        },
        "generator_package_init": {
          "const": {
            "path": "src/e3_inputs/__init__.py",
            "sha256": "28c94c63bea2cfff55742abdb91635254ecdf5f466e1d8c9ea6a152d16eed1d5"
          }
        },
        "schema_path": {"const": "config/r5a/e3_input_contract.schema.json"},
        "validator_path": {"const": "tools/validate_r5a_e3_inputs.py"},
        "test_path": {"const": "tests/test_v11_r5a_e3_inputs.py"},
        "known_subject_rows": {
          "type": "array",
          "minItems": 3,
          "maxItems": 3,
          "items": {"$ref": "#/$defs/subject"}
        },
        "known_target_rows": {
          "type": "array",
          "minItems": 3,
          "maxItems": 3,
          "items": {"$ref": "#/$defs/targetKnownAnswer"}
        },
        "expected_invariants": {
          "const": [
            "32 frozen R5 seeds map to 32 valid rows in exact R5 order",
            "subject, scenario, target, and noise commitments recompute exactly",
            "scenario key and paired disturbance key never contain method_id",
            "week-4 through week-24 missingness is past-only LOCF with flags",
            "parameter and form mismatch alter evaluation only",
            "all bounded actions are infeasible under the 1500-over-1000 rule",
            "R7, effect estimation, participant data, hidden generation, and Results remain closed"
          ]
        },
        "effect_execution_required": {"const": false}
      }
    },
    "permissions": {
      "type": "object",
      "additionalProperties": false,
      "required": [
        "r5a_contract_validation_allowed",
        "public_subject_input_generation_allowed",
        "synthetic_known_answer_tests_allowed",
        "formal_e3_method_execution_allowed",
        "effect_estimation_allowed",
        "method_comparison_allowed",
        "participant_data_access_allowed",
        "hidden_generation_allowed",
        "results_analysis_allowed",
        "results_writing_allowed",
        "remote_mutation_or_release_allowed"
      ],
      "properties": {
        "r5a_contract_validation_allowed": {"const": true},
        "public_subject_input_generation_allowed": {"const": true},
        "synthetic_known_answer_tests_allowed": {"const": true},
        "formal_e3_method_execution_allowed": {"const": false},
        "effect_estimation_allowed": {"const": false},
        "method_comparison_allowed": {"const": false},
        "participant_data_access_allowed": {"const": false},
        "hidden_generation_allowed": {"const": false},
        "results_analysis_allowed": {"const": false},
        "results_writing_allowed": {"const": false},
        "remote_mutation_or_release_allowed": {"const": false}
      }
    },
    "next_gate": {
      "type": "object",
      "additionalProperties": false,
      "required": [
        "id",
        "authorized",
        "separate_author_confirmation_required",
        "formal_effect_execution_allowed"
      ],
      "properties": {
        "id": {"const": "V11_R7_FORMAL_EXECUTION_AUTHORIZATION"},
        "authorized": {"const": false},
        "separate_author_confirmation_required": {"const": true},
        "formal_effect_execution_allowed": {"const": false}
      }
    }
  },
  "$defs": {
    "sha256": {
      "type": "string",
      "pattern": "^[0-9a-f]{64}$"
    },
    "pathHash": {
      "type": "object",
      "additionalProperties": false,
      "required": ["path", "sha256"],
      "properties": {
        "path": {"type": "string", "minLength": 1},
        "sha256": {"$ref": "#/$defs/sha256"}
      }
    },
    "subject": {
      "type": "object",
      "additionalProperties": false,
      "required": [
        "subject_id",
        "seed_u64",
        "age_year",
        "height_cm",
        "bmi_kg_m2",
        "weight_kg",
        "background_pal",
        "sex_model_branch",
        "adult_nonpregnant_nonlactating"
      ],
      "properties": {
        "subject_id": {"type": "string", "pattern": "^VS-[0-9]{3}$"},
        "seed_u64": {"type": "string", "pattern": "^(0|[1-9][0-9]{0,19})$"},
        "age_year": {"type": "string", "pattern": "^(3[0-9]|[4-6][0-9]|7[0-8])$"},
        "height_cm": {"type": "string", "pattern": "^[0-9]{3}\\.[0-9]$"},
        "bmi_kg_m2": {"type": "string", "pattern": "^[0-9]{2}\\.[0-9]$"},
        "weight_kg": {"type": "string", "pattern": "^[0-9]{2,3}\\.[0-9]{6}$"},
        "background_pal": {"type": "string", "pattern": "^[12]\\.[0-9]{3}$"},
        "sex_model_branch": {"const": "female"},
        "adult_nonpregnant_nonlactating": {"const": true}
      }
    },
    "scenarioRule": {
      "type": "object",
      "additionalProperties": false,
      "required": [
        "scenario_id",
        "initial_state_layer",
        "observation_layer",
        "planning_model_layer",
        "feasibility_layer",
        "execution_layer",
        "evaluation_model_layer",
        "paired_random_streams"
      ],
      "properties": {
        "scenario_id": {"type": "string", "minLength": 1},
        "initial_state_layer": {"type": "string", "minLength": 1},
        "observation_layer": {"type": "string", "minLength": 1},
        "planning_model_layer": {"const": "M_P_HALL_NONLINEAR_NOMINAL"},
        "feasibility_layer": {"type": "string", "minLength": 1},
        "execution_layer": {"type": "string", "minLength": 1},
        "evaluation_model_layer": {"type": "string", "minLength": 1},
        "paired_random_streams": {
          "type": "array",
          "maxItems": 1,
          "items": {"const": "observation_mass_gaussian"}
        }
      }
    },
    "noiseKnownAnswer": {
      "type": "object",
      "additionalProperties": false,
      "required": [
        "subject_id",
        "replicate_index",
        "decision_week",
        "noise_kg"
      ],
      "properties": {
        "subject_id": {"type": "string", "pattern": "^VS-[0-9]{3}$"},
        "replicate_index": {"type": "integer", "minimum": 0, "maximum": 2},
        "decision_week": {"type": "integer", "minimum": 0, "maximum": 25},
        "noise_kg": {"type": "string", "pattern": "^-?[0-9]+\\.[0-9]{12}$"}
      }
    },
    "targetKnownAnswer": {
      "type": "object",
      "additionalProperties": false,
      "required": [
        "subject_id",
        "scenario_id",
        "initial_mass_kg",
        "target_mass_kg"
      ],
      "properties": {
        "subject_id": {"type": "string", "pattern": "^VS-[0-9]{3}$"},
        "scenario_id": {"type": "string", "minLength": 1},
        "initial_mass_kg": {"type": "string", "pattern": "^[0-9]{2,3}\\.[0-9]{6}$"},
        "target_mass_kg": {"type": "string", "pattern": "^[0-9]{2,3}\\.[0-9]{6}$"}
      }
    }
  }
}
