{
  "contract_id": "WGT-V11-R5A-E3-INPUT-CONTRACT-01",
  "schema_version": "1.0.0",
  "protocol_stage": "R5a",
  "status": "RESULT_BLIND_E3_INPUTS_AND_SCENARIO_SEMANTICS_FROZEN__NO_EFFECT_EXECUTION_AUTHORITY",
  "frozen_date": "2026-07-25",
  "author_authorization_text": "R5A_E3_INPUTS_FROZEN",
  "material_passport": {
    "origin_skill": "academic-research-suite/experiment-agent",
    "origin_mode": "plan",
    "verification_status": "RESULT_BLIND_INPUT_CONTRACT_VALIDATED",
    "version_label": "v11_r5a_e3_input_freeze_v1"
  },
  "result_awareness_boundary": {
    "legacy_g5c_effects_read_or_analyzed": false,
    "r6_effect_values_read_or_analyzed": false,
    "formal_e3_method_execution_performed": false,
    "effect_estimation_performed": false,
    "method_comparison_performed": false,
    "participant_level_data_accessed": false,
    "hidden_seed_or_instance_accessed_or_generated": false,
    "results_analysis_performed": false,
    "results_section_written": false
  },
  "upstream_bindings": {
    "implementation_git_root": ".",
    "branch": "dev",
    "r6_base_commit": "a878178fd11dd1dcc7d9f32d6f1332412ea3b88a",
    "r6_base_tree": "cf6e300f94577618fdd26d3a4cf90d7f90ed78b7",
    "r5_contract": {
      "path": "config/r5/r5_freeze_contract.json",
      "sha256": "4e2dd0a0f4a97b57d71dd13eb60aa8a3c3eb34f0708aae609d50a31d155f6554"
    },
    "r6_contract": {
      "path": "config/r6/r6_pilot_contract.json",
      "sha256": "87707ecdde803834eaa47e08fd7e62c734137745687f67ad9eb4058f288d45ce"
    },
    "scientific_models": {
      "path": "src/weight_application/scientific_models.py",
      "sha256": "acee4bf57336017b9136d518984b7a84487aa3ce8c33e45b74296097968e98bf"
    },
    "decision_contract": {
      "path": "src/weight_application/decisions.py",
      "sha256": "f7f327d9d3303af71dd78fb357d294295816d077d5287e8dcd5ea42612ff3c31"
    },
    "r3_model_qualification_status": "MODEL_QUALIFICATION_FAILED_POINT_MODEL_NOT_QUALIFIED_ONE_TIME_CONSUMED",
    "weight_case_name": "illustrative_mechanistic_simulation"
  },
  "subject_generator": {
    "generator_id": "WGT-V11-R5A-E3-SUBJECT-GENERATOR-01",
    "version": "1.0.0",
    "seed_source": "R5 seed_contract.e3_public_subjects in frozen order",
    "domain_ascii_with_terminal_nul": "WGT-V11-R5A-E3-SUBJECT-PARAMETER-v1\\0",
    "digest": "SHA-256",
    "field_derivation": "first8_big_endian(SHA256(domain || seed_u64_be8 || NUL || ASCII(field_label))) modulo the declared integer-grid size",
    "field_grids": {
      "age_year": {
        "field_label": "age_year",
        "integer_min": 30,
        "integer_max": 78,
        "grid_size": 49
      },
      "height_cm": {
        "field_label": "height_cm_tenths",
        "integer_tenths_min": 1500,
        "integer_tenths_max": 1800,
        "grid_size": 301
      },
      "bmi_kg_m2": {
        "field_label": "bmi_kg_m2_tenths",
        "integer_tenths_min": 250,
        "integer_tenths_max": 500,
        "grid_size": 251
      },
      "background_pal": {
        "field_label": "background_pal_thousandths",
        "integer_thousandths_min": 1400,
        "integer_thousandths_max": 2500,
        "grid_size": 1101
      }
    },
    "weight_identity": "weight_kg = bmi_kg_m2 * (height_cm / 100)^2",
    "rounding": "decimal ROUND_HALF_EVEN to 0.000001 kg after BMI-height identity",
    "public_subject_count": 32,
    "public_subject_parameters": [
      {"subject_id": "VS-000", "seed_u64": "1198773463880775798", "age_year": "54", "height_cm": "166.1", "bmi_kg_m2": "44.5", "weight_kg": "122.771984", "background_pal": "2.301", "sex_model_branch": "female", "adult_nonpregnant_nonlactating": true},
      {"subject_id": "VS-001", "seed_u64": "3603933269877878136", "age_year": "53", "height_cm": "150.4", "bmi_kg_m2": "48.6", "weight_kg": "109.933978", "background_pal": "2.322", "sex_model_branch": "female", "adult_nonpregnant_nonlactating": true},
      {"subject_id": "VS-002", "seed_u64": "17080443396804730046", "age_year": "44", "height_cm": "154.5", "bmi_kg_m2": "38.1", "weight_kg": "90.945652", "background_pal": "2.274", "sex_model_branch": "female", "adult_nonpregnant_nonlactating": true},
      {"subject_id": "VS-003", "seed_u64": "7390124963704745544", "age_year": "35", "height_cm": "172.8", "bmi_kg_m2": "31.7", "weight_kg": "94.655693", "background_pal": "1.780", "sex_model_branch": "female", "adult_nonpregnant_nonlactating": true},
      {"subject_id": "VS-004", "seed_u64": "9234882481171758316", "age_year": "54", "height_cm": "176.1", "bmi_kg_m2": "39.6", "weight_kg": "122.804392", "background_pal": "1.924", "sex_model_branch": "female", "adult_nonpregnant_nonlactating": true},
      {"subject_id": "VS-005", "seed_u64": "7195286313286325698", "age_year": "42", "height_cm": "154.6", "bmi_kg_m2": "32.9", "weight_kg": "78.634816", "background_pal": "2.063", "sex_model_branch": "female", "adult_nonpregnant_nonlactating": true},
      {"subject_id": "VS-006", "seed_u64": "8411248901729083755", "age_year": "45", "height_cm": "179.2", "bmi_kg_m2": "48.4", "weight_kg": "155.425178", "background_pal": "2.053", "sex_model_branch": "female", "adult_nonpregnant_nonlactating": true},
      {"subject_id": "VS-007", "seed_u64": "9906583270209057167", "age_year": "55", "height_cm": "152.6", "bmi_kg_m2": "39.3", "weight_kg": "91.516967", "background_pal": "1.729", "sex_model_branch": "female", "adult_nonpregnant_nonlactating": true},
      {"subject_id": "VS-008", "seed_u64": "2398719589979475313", "age_year": "51", "height_cm": "177.3", "bmi_kg_m2": "26.3", "weight_kg": "82.674813", "background_pal": "2.204", "sex_model_branch": "female", "adult_nonpregnant_nonlactating": true},
      {"subject_id": "VS-009", "seed_u64": "2411018592510814007", "age_year": "76", "height_cm": "178.4", "bmi_kg_m2": "36.3", "weight_kg": "115.530413", "background_pal": "2.334", "sex_model_branch": "female", "adult_nonpregnant_nonlactating": true},
      {"subject_id": "VS-010", "seed_u64": "14703942009428850206", "age_year": "71", "height_cm": "167.5", "bmi_kg_m2": "45.4", "weight_kg": "127.375375", "background_pal": "2.325", "sex_model_branch": "female", "adult_nonpregnant_nonlactating": true},
      {"subject_id": "VS-011", "seed_u64": "9403871204347584863", "age_year": "59", "height_cm": "160.9", "bmi_kg_m2": "35.6", "weight_kg": "92.164164", "background_pal": "2.080", "sex_model_branch": "female", "adult_nonpregnant_nonlactating": true},
      {"subject_id": "VS-012", "seed_u64": "17090376362706085313", "age_year": "69", "height_cm": "169.5", "bmi_kg_m2": "43.3", "weight_kg": "124.401982", "background_pal": "2.474", "sex_model_branch": "female", "adult_nonpregnant_nonlactating": true},
      {"subject_id": "VS-013", "seed_u64": "2954489579414998280", "age_year": "74", "height_cm": "172.5", "bmi_kg_m2": "41.7", "weight_kg": "124.083562", "background_pal": "2.237", "sex_model_branch": "female", "adult_nonpregnant_nonlactating": true},
      {"subject_id": "VS-014", "seed_u64": "4104000258291922738", "age_year": "59", "height_cm": "175.9", "bmi_kg_m2": "43.6", "weight_kg": "134.901932", "background_pal": "1.937", "sex_model_branch": "female", "adult_nonpregnant_nonlactating": true},
      {"subject_id": "VS-015", "seed_u64": "17613855585818145752", "age_year": "60", "height_cm": "157.8", "bmi_kg_m2": "36.1", "weight_kg": "89.892032", "background_pal": "2.099", "sex_model_branch": "female", "adult_nonpregnant_nonlactating": true},
      {"subject_id": "VS-016", "seed_u64": "14349498237441037305", "age_year": "70", "height_cm": "159.9", "bmi_kg_m2": "25.3", "weight_kg": "64.687065", "background_pal": "1.596", "sex_model_branch": "female", "adult_nonpregnant_nonlactating": true},
      {"subject_id": "VS-017", "seed_u64": "9942285718792173047", "age_year": "57", "height_cm": "166.7", "bmi_kg_m2": "36.4", "weight_kg": "101.151560", "background_pal": "1.832", "sex_model_branch": "female", "adult_nonpregnant_nonlactating": true},
      {"subject_id": "VS-018", "seed_u64": "12609201133635620656", "age_year": "47", "height_cm": "170.9", "bmi_kg_m2": "32.6", "weight_kg": "95.214201", "background_pal": "1.553", "sex_model_branch": "female", "adult_nonpregnant_nonlactating": true},
      {"subject_id": "VS-019", "seed_u64": "15985830750375515839", "age_year": "44", "height_cm": "158.4", "bmi_kg_m2": "34.1", "weight_kg": "85.558810", "background_pal": "2.152", "sex_model_branch": "female", "adult_nonpregnant_nonlactating": true},
      {"subject_id": "VS-020", "seed_u64": "14118186886375554889", "age_year": "73", "height_cm": "161.0", "bmi_kg_m2": "42.7", "weight_kg": "110.682670", "background_pal": "1.884", "sex_model_branch": "female", "adult_nonpregnant_nonlactating": true},
      {"subject_id": "VS-021", "seed_u64": "5218377415477140744", "age_year": "57", "height_cm": "177.0", "bmi_kg_m2": "28.7", "weight_kg": "89.914230", "background_pal": "2.322", "sex_model_branch": "female", "adult_nonpregnant_nonlactating": true},
      {"subject_id": "VS-022", "seed_u64": "954213975187225924", "age_year": "50", "height_cm": "168.7", "bmi_kg_m2": "28.8", "weight_kg": "81.963907", "background_pal": "1.416", "sex_model_branch": "female", "adult_nonpregnant_nonlactating": true},
      {"subject_id": "VS-023", "seed_u64": "16159531877187310112", "age_year": "56", "height_cm": "152.3", "bmi_kg_m2": "41.5", "weight_kg": "96.260454", "background_pal": "1.720", "sex_model_branch": "female", "adult_nonpregnant_nonlactating": true},
      {"subject_id": "VS-024", "seed_u64": "11263643202628897103", "age_year": "33", "height_cm": "169.0", "bmi_kg_m2": "27.7", "weight_kg": "79.113970", "background_pal": "1.898", "sex_model_branch": "female", "adult_nonpregnant_nonlactating": true},
      {"subject_id": "VS-025", "seed_u64": "992189382034892417", "age_year": "33", "height_cm": "171.2", "bmi_kg_m2": "40.6", "weight_kg": "118.996326", "background_pal": "1.966", "sex_model_branch": "female", "adult_nonpregnant_nonlactating": true},